{
  "version": 1,
  "project": {
    "name": "lumen",
    "subtitle": "in the wild",
    "url": "https://example.com/lumen",
    "colors": {
      "accent": "#7c6cff",
      "accent2": "#f08bd0"
    }
  },
  "generated": "2026-06-01T12:00:00Z",
  "items": [
    {
      "id": "387a333657ed59f0",
      "source": "x",
      "kind": "reply",
      "url": "https://example.org/x/reply/00040",
      "title": "Bookmarking lumen for the weekend",
      "author": "@copperleaf",
      "published": "2026-05-31T14:58:30Z",
      "excerpt": "Bookmarking lumen for the weekend. Config below.",
      "metrics": {
        "likes": 124,
        "replies": 10,
        "reposts": 2,
        "views": 5131
      },
      "relevance": "unverified",
      "reason": "says lumen without context"
    },
    {
      "id": "54eeaa3d39bd134f",
      "source": "x",
      "kind": "post",
      "url": "https://example.org/x/post/00042",
      "title": "lumen's keyboard map is the best part, everything is one key away",
      "author": "@lowtide",
      "published": "2026-05-31T14:57:44Z",
      "excerpt": "lumen's keyboard map is the best part, everything is one key away. ",
      "metrics": {
        "likes": 102,
        "replies": 6,
        "reposts": 20,
        "views": 5281
      },
      "relevance": "real",
      "reason": "links the project page"
    },
    {
      "id": "9beb652ea52daad2",
      "source": "x",
      "kind": "post",
      "url": "https://example.org/x/post/00018",
      "title": "Small thing, but the lumen clock font is lovely",
      "author": "@orchardloop",
      "published": "2026-05-31T14:09:08Z",
      "excerpt": "Small thing, but the lumen clock font is lovely. Highly recommend.",
      "metrics": {
        "likes": 48,
        "replies": 4,
        "reposts": 7,
        "views": 2272
      },
      "relevance": "real",
      "reason": "links the project page"
    },
    {
      "id": "55d0a121aba725c1",
      "source": "github",
      "kind": "code",
      "group": "dotfiles",
      "url": "https://example.com/sablefin/dots",
      "title": "sablefin/dots",
      "author": "sablefin",
      "published": "2026-05-31T03:08:18Z",
      "files": [
        ".config/lumen/config.toml",
        ".config/lumen/widgets/clock.toml",
        "install.sh"
      ],
      "relevance": "likely"
    },
    {
      "id": "f1c6387a5a77617a",
      "source": "hackernews",
      "kind": "comment",
      "url": "https://example.org/hackernews/comment/00033",
      "title": "Three weeks with lumen on my work laptop. Short review in the thread",
      "author": "ravenmoss",
      "published": "2026-05-31T02:25:30Z",
      "excerpt": "Three weeks with lumen on my work laptop. Short review in the thread. Highly recommend.",
      "metrics": {
        "comments": 27,
        "points": 197
      },
      "relevance": "real",
      "reason": "links the project page"
    },
    {
      "id": "4f9d1f22f46aaed5",
      "source": "x",
      "kind": "post",
      "url": "https://example.org/x/post/00012",
      "title": "lumen's keyboard map is the best part, everything is one key away",
      "author": "@cindertrail",
      "published": "2026-05-30T12:46:11Z",
      "excerpt": "lumen's keyboard map is the best part, everything is one key away. Screenshots in the thread.",
      "metrics": {
        "likes": 94,
        "replies": 7,
        "reposts": 15,
        "views": 11631
      },
      "relevance": "real",
      "reason": "links the project page"
    },
    {
      "id": "1aecc61ef44d2ff7",
      "source": "github",
      "kind": "pr",
      "url": "https://example.com/fogline/awesome-tui/pr/77",
      "title": "fogline/awesome-tui: nix: add lumen module",
      "author": "fogline",
      "published": "2026-05-30T10:29:34Z",
      "metrics": {
        "comments": 8,
        "reactions": 8
      },
      "relevance": "likely"
    },
    {
      "id": "5df29a22f8da8a28",
      "source": "lemmy",
      "kind": "post",
      "url": "https://example.org/lemmy/post/00031",
      "title": "Shipping a lumen theme pack this week",
      "author": "thistle_dev",
      "published": "2026-05-29T22:37:53Z",
      "excerpt": "Shipping a lumen theme pack this week. Highly recommend.",
      "metrics": {
        "comments": 55,
        "points": 11
      },
      "relevance": "real",
      "reason": "links the project page"
    },
    {
      "id": "937201a604323af9",
      "source": "registry",
      "kind": "package",
      "url": "https://example.org/packages/lumen",
      "title": "lumen on the package index",
      "author": "package index",
      "published": "2026-05-29T21:51:36Z",
      "metrics": {
        "installs_30d": 2140,
        "installs_90d": 5302
      }
    },
    {
      "id": "3921eb4aabd31db1",
      "source": "bluesky",
      "kind": "post",
      "url": "https://example.org/bluesky/post/00026",
      "title": "lumen just saved me from missing a failing deploy",
      "author": "@brambleworks",
      "published": "2026-05-29T15:34:40Z",
      "excerpt": "lumen just saved me from missing a failing deploy. ",
      "metrics": {
        "likes": 27,
        "replies": 4,
        "reposts": 2
      },
      "relevance": "real",
      "reason": "links the project page"
    },
    {
      "id": "550074e4aaa3e6a0",
      "source": "x",
      "kind": "post",
      "url": "https://example.org/x/post/00035",
      "title": "Finally a dashboard that respects my colour scheme",
      "author": "@fogline",
      "published": "2026-05-29T14:40:47Z",
      "excerpt": "Finally a dashboard that respects my colour scheme. Highly recommend.",
      "metrics": {
        "likes": 85,
        "replies": 10,
        "reposts": 19,
        "views": 7092
      },
      "relevance": "real",
      "reason": "links the project page"
    },
    {
      "id": "be9b994e99b22a80",
      "source": "hackernews",
      "kind": "comment",
      "url": "https://example.org/hackernews/comment/00022",
      "title": "Tried lumen today. The defaults are good enough that I barely changed anything",
      "author": "copperleaf",
      "published": "2026-05-29T09:25:21Z",
      "excerpt": "Tried lumen today. The defaults are good enough that I barely changed anything. Config below.",
      "metrics": {
        "comments": 50,
        "points": 166
      },
      "relevance": "unverified",
      "reason": "says lumen without context"
    },
    {
      "id": "c297704e2d01b1b6",
      "source": "bluesky",
      "kind": "post",
      "url": "https://example.org/bluesky/post/00037",
      "title": "My lumen config is now 12 lines long and does everything I need",
      "author": "@marrowlight",
      "published": "2026-05-29T03:08:21Z",
      "excerpt": "My lumen config is now 12 lines long and does everything I need. Screenshots in the thread.",
      "metrics": {
        "likes": 67,
        "replies": 4,
        "reposts": 5
      },
      "relevance": "unverified",
      "reason": "says lumen without context"
    },
    {
      "id": "f8d31c26ef285e0f",
      "source": "hackernews",
      "kind": "comment",
      "url": "https://example.org/hackernews/comment/00036",
      "title": "lumen and a cup of tea: my morning standup view",
      "author": "sablefin",
      "published": "2026-05-28T19:50:23Z",
      "excerpt": "lumen and a cup of tea: my morning standup view. Config below.",
      "metrics": {
        "comments": 42,
        "points": 81
      },
      "relevance": "likely",
      "reason": "names lumen with terminal words"
    },
    {
      "id": "17b18f640adc5c7d",
      "source": "reddit",
      "kind": "post",
      "url": "https://example.org/noise/95",
      "title": "lumen of the room was perfect",
      "author": "copperleaf",
      "published": "2026-05-28T15:57:47Z",
      "relevance": "noise",
      "reason": "the word lumen, not the project"
    },
    {
      "id": "f86bd4f05d1cf939",
      "source": "youtube",
      "kind": "video",
      "url": "https://example.com/video/0006",
      "title": "Building a lumen widget from scratch",
      "author": "Code by Candlelight",
      "published": "2026-05-27T22:41:28Z",
      "excerpt": "A walk through clocks, themes and the keys you need on day one.",
      "metrics": {
        "comments": 64,
        "likes": 56,
        "views": 1993
      }
    },
    {
      "id": "979c0945f324c74c",
      "source": "x",
      "kind": "reply",
      "url": "https://example.org/x/reply/00038",
      "title": "Ported my conky setup to lumen in an evening",
      "author": "@mossbyte",
      "published": "2026-05-26T19:57:37Z",
      "excerpt": "Ported my conky setup to lumen in an evening. Highly recommend.",
      "metrics": {
        "likes": 120,
        "replies": 3,
        "reposts": 16,
        "views": 5729
      },
      "relevance": "real",
      "reason": "links the project page"
    },
    {
      "id": "e5d3cd1637e5edc9",
      "source": "web",
      "kind": "article",
      "url": "https://example.net/articles/060",
      "title": "lumen and the case for small tools",
      "author": "Small Tools Review",
      "published": "2026-05-26T17:16:51Z",
      "excerpt": "A long read about widgets and why small tools win.",
      "reason": "links the project page"
    },
    {
      "id": "055b61a158cc5a0a",
      "source": "github",
      "kind": "pr",
      "url": "https://example.com/inkwell/weekly/pr/76",
      "title": "inkwell/weekly: docs: mention lumen in the README",
      "author": "inkwell",
      "published": "2026-05-26T13:11:46Z",
      "metrics": {
        "comments": 12,
        "reactions": 8
      },
      "relevance": "real"
    },
    {
      "id": "51f6a074cdffaee8",
      "source": "github",
      "kind": "pr",
      "url": "https://example.com/copperleaf/dotfiles/pr/70",
      "title": "copperleaf/dotfiles: lumen: 0.9.1 -\u003e 1.0.0",
      "author": "copperleaf",
      "published": "2026-05-26T11:17:43Z",
      "metrics": {
        "comments": 5,
        "reactions": 9
      },